<?xml version="1.0"?>
<timetabling xmlns:xsi="http://www.w3.org/2001/XMLSchema-instance" xsi:schemaLocation="usp_timetabling_v0_2.xsd" name="ua_l3info_2021" nrWeeks="12" nrDaysPerWeek="5" nrSlotsPerDay="1440">
  <rooms>
    <room id="AMPHI-A" capacity="90" label="BUILDING-A"/>
    <room id="AMPHI-B" capacity="286" label="BUILDING-A"/>
    <room id="L201" capacity="46" label="BUILDING-L"/>
    <room id="L202" capacity="46" label="BUILDING-L"/>
    <room id="L206" capacity="28" label="BUILDING-L"/>
    <room id="H001" capacity="20" label="BUILDING-H"/>
    <room id="H002" capacity="42" label="BUILDING-H"/>
    <room id="H003" capacity="38" label="BUILDING-H"/>
  </rooms>
  <teachers>
    <teacher id="Teacher 1" label="ENGLISH"/>
    <teacher id="Teacher 2" label="COMPUTER-SCIENCES-DEPT"/>
    <teacher id="Teacher 3" label="COMPUTER-SCIENCES-DEPT"/>
    <teacher id="Teacher 4" label="COMPUTER-SCIENCES-DEPT"/>
    <teacher id="Teacher 5" label="COMPUTER-SCIENCES-DEPT"/>
    <teacher id="Teacher 6" label="COMPUTER-SCIENCES-DEPT"/>
    <teacher id="Teacher 7" label="COMPUTER-SCIENCES-DEPT"/>
    <teacher id="Teacher 8" label="COMPUTER-SCIENCES-DEPT"/>
    <teacher id="Teacher 9" label="COMPUTER-SCIENCES-DEPT"/>
    <teacher id="Teacher 10" label="COMPUTER-SCIENCES-DEPT"/>
    <teacher id="Teacher 11" label="COMPUTER-SCIENCES-DEPT"/>
    <teacher id="Teacher 12" label="COMPUTER-SCIENCES-DEPT"/>
  </teachers>
  <courses>
    <course id="English">
      <part id="English-Les" nrSessions="8" label="LESSON">
        <classes>
          <class id="English-Les-1" maxHeadCount="30"/>
          <class id="English-Les-2" maxHeadCount="30"/>
          <class id="English-Les-3" maxHeadCount="30"/>
        </classes>
        <allowedSlots sessionLength="120">
          <!-- 2h00 -->
          <!-- 08:00, 08:50, 09:30, 10:20, 11:00, 11:50, 12:30, 13:20, 14:00, 14:50, 15:30, 16:20, 17:00 -->
          <dailySlots>480,530,570,620,660,710,750,800,840,890,930,980,1020</dailySlots>
          <days>1-5</days>
          <!-- Mon to Fri -->
          <weeks>1-12</weeks>
          <!-- all the weeks -->
        </allowedSlots>
        <allowedRooms sessionRooms="single">
          <room refId="L201"/>
          <room refId="L202"/>
          <room refId="L206"/>
        </allowedRooms>
        <allowedTeachers sessionTeachers="1">
          <teacher refId="Teacher 1" nrSessions="24"/>
        </allowedTeachers>
      </part>
      <part id="English-Eval" nrSessions="1" label="EVAL">
        <classes>
          <class id="English-Eval-1" maxHeadCount="20"/>
        </classes>
        <allowedSlots sessionLength="120">
          <!-- 2h00 -->
          <!-- 08:00, 08:50, 09:30, 10:20, 11:00, 11:50, 12:30, 13:20, 14:00, 14:50, 15:30, 16:20, 17:00 -->
          <dailySlots>480,530,570,620,660,710,750,800,840,890,930,980,1020</dailySlots>
          <days>1-5</days>
          <!-- Mon to Fri -->
          <weeks>1-12</weeks>
          <!-- all the weeks -->
        </allowedSlots>
        <allowedRooms sessionRooms="single">
          <room refId="AMPHI-A"/>
          <room refId="AMPHI-B"/>
        </allowedRooms>
        <allowedTeachers sessionTeachers="1">
          <teacher refId="Teacher 1" nrSessions="1"/>
        </allowedTeachers>
      </part>
    </course>
    <course id="Databases-part2">
      <part id="Databases-part2-Lec" nrSessions="8" label="LECTURE">
        <classes>
          <class id="Databases-part2-Lec-1" maxHeadCount="80"/>
        </classes>
        <allowedSlots sessionLength="80">
          <!-- 1h20 -->
          <!-- 08:00, 09:30, 11:00, 12:30, 14:00, 15:30, 17:00, 18:30 -->
          <dailySlots>480,570,660,750,840,930,1020,1110</dailySlots>
          <days>1-5</days>
          <!-- Mon to Fri -->
          <weeks>1-12</weeks>
          <!-- all the weeks -->
        </allowedSlots>
        <allowedRooms sessionRooms="single">
          <room refId="AMPHI-A"/>
          <room refId="AMPHI-B"/>
        </allowedRooms>
        <allowedTeachers sessionTeachers="1">
          <teacher refId="Teacher 2" nrSessions="8"/>
        </allowedTeachers>
      </part>
      <part id="Databases-part2-Tut" nrSessions="9" label="TUTORIAL">
        <classes>
          <class id="Databases-part2-Tut-1" maxHeadCount="40" parent="Databases-part2-Lec-1"/>
          <class id="Databases-part2-Tut-2" maxHeadCount="40" parent="Databases-part2-Lec-1"/>
        </classes>
        <allowedSlots sessionLength="80">
          <!-- 1h20 -->
          <!-- 08:00, 09:30, 11:00, 12:30, 14:00, 15:30, 17:00, 18:30 -->
          <dailySlots>480,570,660,750,840,930,1020,1110</dailySlots>
          <days>1-5</days>
          <!-- Mon to Fri -->
          <weeks>1-12</weeks>
          <!-- all the weeks -->
        </allowedSlots>
        <allowedRooms sessionRooms="single">
          <room refId="L201"/>
          <room refId="L202"/>
          <room refId="L206"/>
        </allowedRooms>
        <allowedTeachers sessionTeachers="1">
          <teacher refId="Teacher 2" nrSessions="18"/>
        </allowedTeachers>
      </part>
      <part id="Databases-part2-Lab" nrSessions="7" label="LABORATORY">
        <classes>
          <class id="Databases-part2-Lab-1" maxHeadCount="20" parent="Databases-part2-Tut-1"/>
          <class id="Databases-part2-Lab-2" maxHeadCount="20" parent="Databases-part2-Tut-2"/>
          <class id="Databases-part2-Lab-3" maxHeadCount="20" parent="Databases-part2-Tut-1"/>
        </classes>
        <allowedSlots sessionLength="170">
          <!-- 2x(1h20) + 10min break -->
          <!-- 08:00, 09:30, 12:30, 14:00, 15:30, 17:00 -->
          <dailySlots>480,570,750,840,930,1020</dailySlots>
          <days>1-5</days>
          <!-- Mon to Fri -->
          <weeks>1-12</weeks>
          <!-- all the weeks -->
        </allowedSlots>
        <allowedRooms sessionRooms="single">
          <room refId="H001"/>
          <room refId="H002"/>
          <room refId="H003"/>
        </allowedRooms>
        <allowedTeachers sessionTeachers="1">
          <teacher refId="Teacher 2" nrSessions="14"/>
          <teacher refId="Teacher 3" nrSessions="7"/>
        </allowedTeachers>
      </part>
      <part id="Databases-part2-LabEval" nrSessions="1" label="LABORATORY,EVAL">
        <classes>
          <class id="Databases-part2-LabEval-1" maxHeadCount="20" parent="Databases-part2-Lab-1"/>
          <class id="Databases-part2-LabEval-2" maxHeadCount="20" parent="Databases-part2-Lab-2"/>
          <class id="Databases-part2-LabEval-3" maxHeadCount="20" parent="Databases-part2-Lab-3"/>
        </classes>
        <allowedSlots sessionLength="170">
          <!-- 2x(1h20) + 10min break -->
          <!-- 08:00, 09:30, 12:30, 14:00, 15:30, 17:00 -->
          <dailySlots>480,570,750,840,930,1020</dailySlots>
          <days>1-5</days>
          <!-- Mon to Fri -->
          <weeks>1-12</weeks>
          <!-- all the weeks -->
        </allowedSlots>
        <allowedRooms sessionRooms="multiple">
          <room refId="H001"/>
          <room refId="H002"/>
          <room refId="H003"/>
        </allowedRooms>
        <allowedTeachers sessionTeachers="1">
          <teacher refId="Teacher 2" nrSessions="1"/>
          <teacher refId="Teacher 3" nrSessions="1"/>
          <teacher refId="Teacher 4" nrSessions="1"/>
        </allowedTeachers>
      </part>
    </course>
    <course id="Web-Development">
      <part id="Web-Development-Lec" nrSessions="12" label="LECTURE">
        <classes>
          <class id="Web-Development-Lec-1" maxHeadCount="80"/>
        </classes>
        <allowedSlots sessionLength="80">
          <!-- 1h20 -->
          <!-- 08:00, 09:30, 11:00, 12:30, 14:00, 15:30, 17:00, 18:30 -->
          <dailySlots>480,570,660,750,840,930,1020,1110</dailySlots>
          <days>1-5</days>
          <!-- Mon to Fri -->
          <weeks>1-12</weeks>
          <!-- all the weeks -->
        </allowedSlots>
        <allowedRooms sessionRooms="single">
          <room refId="AMPHI-A"/>
          <room refId="AMPHI-B"/>
        </allowedRooms>
        <allowedTeachers sessionTeachers="1">
          <teacher refId="Teacher 5" nrSessions="12"/>
        </allowedTeachers>
      </part>
      <part id="Web-Development-Lab" nrSessions="8" label="LABORATORY">
        <classes>
          <class id="Web-Development-Lab-1" maxHeadCount="25" parent="Web-Development-Lec-1"/>
          <class id="Web-Development-Lab-2" maxHeadCount="28" parent="Web-Development-Lec-1"/>
          <class id="Web-Development-Lab-3" maxHeadCount="25" parent="Web-Development-Lec-1"/>
        </classes>
        <allowedSlots sessionLength="170">
          <!-- 2x(1h20) + 10min break -->
          <!-- 08:00, 09:30, 12:30, 14:00, 15:30, 17:00 -->
          <dailySlots>480,570,750,840,930,1020</dailySlots>
          <days>1-5</days>
          <!-- Mon to Fri -->
          <weeks>1-12</weeks>
          <!-- all the weeks -->
        </allowedSlots>
        <allowedRooms sessionRooms="single">
          <room refId="H001"/>
          <room refId="H002"/>
          <room refId="H003"/>
        </allowedRooms>
        <allowedTeachers sessionTeachers="1">
          <teacher refId="Teacher 5" nrSessions="16"/>
          <teacher refId="Teacher 6" nrSessions="8"/>
        </allowedTeachers>
      </part>
      <part id="Web-Development-LabEval" nrSessions="1" label="LABORATORY,EVAL">
        <classes>
          <class id="Web-Development-LabEval-1" maxHeadCount="40" parent="Web-Development-Lab-1"/>
          <class id="Web-Development-LabEval-2" maxHeadCount="40" parent="Web-Development-Lab-2"/>
          <class id="Web-Development-LabEval-3" maxHeadCount="40" parent="Web-Development-Lab-3"/>
        </classes>
        <allowedSlots sessionLength="170">
          <!-- 2x(1h20) + 10min break -->
          <!-- 08:00, 09:30, 12:30, 14:00, 15:30, 17:00 -->
          <dailySlots>480,570,750,840,930,1020</dailySlots>
          <days>1-5</days>
          <!-- Mon to Fri -->